,title,rating,name,num_ratings,num_reviews,num_followers,synopsis,genre
68,The Raven King,4.38,Nora Sakavic,"46,571","5,535","4,935 followers","The Foxes are a fractured mess, but their latest disaster might be the miracle they've always needed to come together as a team. The one person standing in their way is Andrew, and the only one who can break through his personal barriers is Neil.

Except Andrew doesn't give up anything for free and Neil is terrible at trusting anyone but himself. The two don't have much time to come to terms with their situation before outside forces start tearing them apart. Riko is intent on destroying Neil's fragile new life, and the Foxes have just become collateral damage.

Neil's days are numbered, but he's learning the hard way to go down fighting for what he believes in, and Neil believes in Andrew even if Andrew won't believe in himself. (less)",sports
69,The King's Men,4.58,Nora Sakavic,"45,549","6,595","4,935 followers","Neil Josten is out of time. He knew when he came to PSU he wouldn't survive the year, but with his death right around the corner he's got more reasons than ever to live.

Befriending the Foxes was inadvisable. Kissing one is unthinkable. Neil should know better than to get involved with anyone this close to the end, but Andrew's never been the easiest person to walk away from. If they both say it doesn't mean anything, maybe Neil won't regret losing it, but the one person Neil can't lie to is himself.

He's got promises to keep and a team to get to championships if he can just outrun Riko a little longer, but Riko's not the only monster in Neil's life. The truth might get them all killed—or be Neil's one shot at getting out of this alive. (less)",sports
70,The Play,4.07,Elle Kennedy,"57,299","4,381","45,382 followers","A brand-new standalone novel in the New York Times bestselling Briar U series!

What I learned after last year’s distractions cost my hockey team our entire season? No more screwing up. No more screwing, period. As the new team captain, I need a new philosophy: hockey and school now, women later. Which means that I, Hunter Davenport, am officially going celibate…no matter how hard that makes things.

But there’s nothing in the rulebook that says I can’t be friends with a woman. And I won’t lie—my new classmate Demi Davis is one cool chick. Her smart mouth is hot as hell, and so is the rest of her, but the fact that she’s got a boyfriend eliminates the temptation to touch her.

Except three months into our friendship, Demi is single and looking for a rebound.

And she’s making a play for me.

Avoiding her is impossible. We’re paired up on a yearlong school project, but I’m confident I can resist her. We’d never work, anyway. Our backgrounds are too different, our goals aren’t aligned, and her parents hate my guts.

Hooking up is a very bad idea. Now I just have to convince my body—and my heart. (less)",sports
71,Hands Down,3.97,Mariana Zapata,"31,441","3,425","39,145 followers","Before he was Big Texas, he was Zac the Snack Pack.

Bianca Brannen knows time--mostly--heals all wounds. Including those your once loved ones might have unintentionally given you. (Those just take longer.)

She thinks she’s ready when a call has her walking back into her old friend’s life. Or at least as prepared as possible to see the starting quarterback in the National Football Organization. Before the lights, the fans, and the millions, he’d been a skinny kid with a heart of gold.

Waltzing out of Zac Travis’s life should be easy. Just as easy as he walked out of hers. (less)",sports
72,Taking a Shot,4.08,Jaci Burton,"18,672",972,"7,981 followers","If you want to score, you have to get in the game... The last thing Jenna Riley needs is more sports in her life. While her brothers are off being athletic superstars, she's stuck running the family's sports bar, whether she likes it or not. Then in walks pro hockey stud Tyler Anderson. As much as Jenna would like to go to the boards with him, she's vowed to never fall for a jock-even one as hot as Ty.

Ty, intrigued by the beautiful bar owner, becomes a regular. He senses that Jenna wants to do something more with her life. And as he gains her trust, the passion between them grows, as does Ty's insistence that Jenna should start living for herself. With his encouragement, Jenna starts to believe it, too...

But first, Jenna has to figure out what she wants, what she needs, who she loves, and if she has the passion and pride to take a shot at having it all-including Ty... (less)",sports
73,What I Talk About When I Talk About Running,3.87,Haruki Murakami,"1,39,333","13,288","103,158 followers","In 1982, having sold his jazz bar to devote himself to writing, Murakami began running to keep fit. A year later, he'd completed a solo course from Athens to Marathon, and now, after dozens of such races, not to mention triathlons and a dozen critically acclaimed books, he reflects upon the influence the sport has had on his life and--even more important--on his writing. Equal parts training log, travelogue, and reminiscence, this revealing memoir covers his four-month preparation for the 2005 New York City Marathon and takes us to places ranging from Tokyo's Jingu Gaien gardens, where he once shared the course with an Olympian, to the Charles River in Boston among young women who outpace him. Through this marvelous lens of sport emerges a panorama of memories and insights: the eureka moment when he decided to become a writer, his greatest triumphs and disappointments, his passion for vintage LPs, and the experience, after fifty, of seeing his race times improve and then fall back. By turns funny and sobering, playful and philosophical, What I Talk About When I Talk About Running is rich and revelatory, both for fans of this masterful yet guardedly private writer and for the exploding population of athletes who find similar satisfaction in distance running."" (less)",sports
74,Changing the Game,4.11,Jaci Burton,"21,392","1,086","7,981 followers","Sports agent Liz Darnell will do anything to win back her number-one client, baseball pro Gavin Riley. And Gavin's more than ready- especially when Liz is offering herself as part of the bargain. But when love unexpectedly enters the playing field, neither Liz nor Gavin are ready for the biggest game-changer of all.
(less)",sports
75,Zack,4.17,Sawyer Bennett,"15,547","1,292","13,450 followers","Rising star Zack Grantham has been stuck in a downward spiral of grief ever since the car accident that left him a single dad and put his career on hold. Back on the road with the Carolina Cold Fury and still crippled by emotional baggage, he’s in need of some serious help with his son. But while the nerdy new nanny wins his son’s heart, Zack isn’t sure he’s ready for a woman’s touch—even after getting a glimpse of the killer curves she’s hiding under those baggy clothes.

Kate Francis usually keeps men like Zack at a distance. Though his athlete’s body is honed to perfection, he refuses to move on with his life—and besides, he’s her boss. Still, the sparks between them are undeniable, tempting Kate to turn their professional relationship into a personal one. But before she makes a power play for Zack’s wounded heart, Kate will have to open him up again and show him that love is worth the fight. (less)",sports
76,Those Guys Have All the Fun: Inside the World of ESPN,3.74,James Andrew Miller,"13,379",658,161 followers,"In the exclusive behind the scenes look, sports fans can unlock the fascinating history of the channel that changed the way people watch and interact with their favorite teams.
It began, in 1979, as a mad idea of starting a cable channel to televise local sporting events throughout the state of Connecticut. Today, ESPN is arguably the most successful network in modern television history, spanning eight channels in the Unites States and around the world. But the inside story of its rise has never been fully told-until now.

Drawing upon over 500 interviews with the greatest names in ESPN's history and an All-Star collection of some of the world's finest athletes, bestselling authors James Miller and Tom Shales take us behind the cameras. Now, in their own words, the men and women who made ESPN great reveal the secrets behind its success-as well as the many scandals, rivalries, off-screen battles and triumphs that have accompanied that ascent. From the unknown producers and business visionaries to the most famous faces on television, it's all here. (less)",sports
77,Jock Row,4.04,Sara Ney,"17,299","1,903","6,020 followers","Scarlett is always the sensible one: The sober driver. The planner. The one holding your hair back while you're worshiping the porcelain gods.

Week-after-week, she visits Jock Row with her friends — the university's hottest party scene and breeding ground for student athletes. And if keeping her friends out of trouble, and guys out of their pants, was a sport, she'd be the star athlete.

Being a well known jock-blocker gets her noticed for all the wrong reasons; just like that, she's banned from Jock Row. NO GUY WANTS A GIRL AROUND WHO KEEPS THEIR JOCK FRIENDS FROM GETTING LAID.

""Rowdy"" Wade is the hot shot short-stop for the university's baseball team — and the unlucky bastard who drew the short straw: keep little Miss Goody Two-Shoes out of the Baseball House.

But week-after-week Scarlett returns, determined to get inside. (less)",sports
78,The Hot Shot,4.16,Kristen Callihan,"16,116","1,443","12,438 followers","First we were friends. Then we were roommates. Now I want more…

What can I say about Chess Copper? The woman is capable of bringing me to my knees. I know this about five minutes after getting naked for her.

No one is more surprised than me. The prickly photographer my team hired to shoot our annual charity calendar isn’t my usual type. She’s defense to my offense, a challenge at every turn. But when I’m with her, all the regrets and darkness goes away. She makes life fun.

I want to know Chess, be close to her. Which is a bad idea.

Chess is looking for a relationship. I’ve never given a woman more than one night. But when fate leaves Chess without a home, I step up and offer her mine. We’re roommates now. Friends without benefits. But it’s getting harder to keep our hands off each other. And the longer we live together the more I realize she’s becoming my everything.

Trick is… Now that I’ve made her believe I’m a bad bet, how do I convince her to give this player a true shot at forever? (less)",sports
79,Garrett,4.04,Sawyer Bennett,"15,630","1,286","13,450 followers","Carolina Cold Fury star Garrett Samuelson never wants to miss out on a single minute of fun. Whether he’s playing hockey, hanging out with friends, or walking the red carpet with a new date on his arm, he lives every day to the fullest. When he meets Olivia Case, he sees someone who’s exactly his type—confident, sexy, smart . . . his next fling. But the more he pursues her, the more Garrett shares a side of himself that other women don’t normally get to see.

Olivia has been keeping a secret. While Garrett lives for the next thrill, Olivia’s not sure she’ll live to see the next day. She’s undergoing treatment for some serious medical issues, and she doesn’t have time for a relationship with no guarantees—especially one with a hot-as-sin womanizer who won’t take no for an answer. But as she gets to know the real Garrett, Olivia can’t help falling for him . . . hard. To reveal the truth would mean risking everything—but you can’t score without taking the tough shots. (less)",sports
80,Puck Me Secretly,4.15,Odette Stone,"20,860","1,869","2,247 followers","I’ve never been in love.
I’ve never had an orgasm, but I’ve faked plenty.
I want to experience love.  Real, passionate love.
I don’t want to die.

It’s funny what blurts out of your mouth when the plane you’re on is going down, and I didn’t hold back with my seat mate when my plane decided to crash.
My hysterical confessions didn’t faze the muscular stranger that sat beside me.  In fact, he promised if we survived, he’d give me my first orgasm.  

We survived.
I came.
And then he left without telling me who he was.

On the first day of my job, I stood in front of the Vancouver Wolves hockey team and called out a number.  #33.
Imagine my shock when he skated forward.

Max is an incredible hockey player, whose wild, out-of-control antics have almost derailed his career.  So many secrets shroud his past and continue to threaten his future.  
Now he’s my secret.  And that secret could ruin everything.  

Puck Me SECRETLY.  Some secrets are too big to keep.

Intended for adult audiences only. (less)",sports
81,Summer of '49,4.09,David Halberstam,"8,890",306,630 followers,"With incredible skill, passion, and insight, Pulitzer Prize–winningauthor David Halberstam returns us to a glorious time when the dreams of a now almost forgotten America rested on the crack of a bat.

The year was 1949, and a war-weary nation turned from the battlefields to the ball fields in search of new heroes. It was a summer that marked the beginning of a sports rivalry unequaled in the annals of athletic competition. The awesome New York Yankees and the indomitable Boston Red Sox were fighting for supremacy of baseball's American League, and an aging Joe DiMaggio and a brash, headstrong hitting phenomenon named Ted Williams led their respective teams in a classic pennant duel of almost mythic proportions—one that would be decided in an explosive head-to-head confrontation on the last day of the season. (less)",sports
82,The Sports Gene: Inside the Science of Extraordinary Athletic Performance,4.2,David Epstein,"13,324","1,005","1,524 followers","Now a New York Times Bestseller! With a new chapter added to the paperback. 

In high school, I wondered whether the Jamaican Americans who made our track team so successful might carry some special speed gene from their tiny island. In college, I ran against Kenyans, and wondered whether endurance genes might have traveled with them from East Africa. At the same time, I began to notice that a training group on my team could consist of five men who run next to one another, stride for stride, day after day, and nonetheless turn out five entirely different runners. How could this be?

We all knew a star athlete in high school. The one who made it look so easy. He was the starting quarterback and shortstop; she was the all-state point guard and high-jumper. Naturals. Or were they?

The debate is as old as physical competition. Are stars like Usain Bolt, Michael Phelps, and Serena Williams genetic freaks put on Earth to dominate their respective sports? Or are they simply normal people who overcame their biological limits through sheer force of will and obsessive training?
The truth is far messier than a simple dichotomy between nature and nurture. In the decade since the sequencing of the human genome, researchers have slowly begun to uncover how the relationship between biological endowments and a competitor’s training environment affects athleticism. Sports scientists have gradually entered the era of modern genetic research.

In this controversial and engaging exploration of athletic success, Sports Illustrated senior writer David Epstein tackles the great nature vs. nurture debate and traces how far science has come in solving this great riddle. He investigates the so-called 10,000-hour rule to uncover whether rigorous and consistent practice from a young age is the only route to athletic excellence.

Along the way, Epstein dispels many of our perceptions about why top athletes excel. He shows why some skills that we assume are innate, like the bullet-fast reactions of a baseball or cricket batter, are not, and why other characteristics that we assume are entirely voluntary, like an athlete’s will to train, might in fact have important genetic components.

This subject necessarily involves digging deep into sensitive topics like race and gender. Epstein explores controversial questions such as:
Are black athletes genetically predetermined to dominate both sprinting and distance running, and are their abilities influenced by Africa’s geography?
Are there genetic reasons to separate male and female athletes in competition?
Should we test the genes of young children to determine if they are destined for stardom?
Can genetic testing determine who is at risk of injury, brain damage, or even death on the field?
Through on-the-ground reporting from below the equator and above the Arctic Circle, revealing conversations with leading scientists and Olympic champions, and interviews with athletes who have rare genetic mutations or physical traits, Epstein forces us to rethink the very nature of athleticism.
  (less)",sports
83,Nobody's Baby But Mine,4.04,Susan Elizabeth Phillips,"39,597","2,043","14,190 followers","Librarian Note: There is an Alternate Cover Edition for this edition of this book here.

Genius physics professor Dr. Jane Darlington desperately wants a baby. But finding a father won’t be easy. Jane’s super-intelligence made her feel like a freak when she was growing up, and she’s determined to spare her own child that suffering. Which means she must find someone very special to father her child. Someone who’s more comfortable working out his muscles than exercising his brain.

Cal Bonner, the Chicago Stars’ legendary quarterback, seems like the perfect choice. But his champion good looks and down-home ways are deceiving. Dr. Jane is about to learn a little too late that this good ol’ boy is a lot smarter than he lets on—and he’s not about to be used and abandoned by a brainy, baby-mad schemer. (less)",sports
84,The Hardest Fall,4.04,Ella Maise,"25,934","2,186","7,284 followers","The first time you meet someone, you make eye contact. You smile, say hello. Should be simple, if you’re anyone but me. The first time I met Dylan Reed, I found myself making eye contact with a different part of his body. You see, I’m very good at being shy, not to mention extremely well-versed in rambling nonsense and, unfortunately, rather highly skilled at making a fool of myself in front of a guy I’m attracted to.

At the time, I knew nothing about him and thought none of what I said would matter since I’d never speak to him again. Turns out, I was very wrong. He was the star wide receiver of the football team, one of the few players expected to make it into the NFL, and I ended up seeing him all over campus.
I might have also propositioned him, run away from him, attacked him with a cooking utensil…and…uh, maybe I shouldn’t tell you all of it. It’s pretty normal stuff, things you’d expect…from me. Eventually, the time came when I couldn’t hide anymore—not that he’d have let me even if I tried.
Before now, he never knew I was secretly watching him. Now that we see each other every day, he knows when I have a hard time looking away. It doesn’t help that I’m not the most subtle person in the world either.

He smiles at me and tells me he finds me fascinating because of my quirks. I can’t even tell him that I think my heart beats differently whenever he’s around.

He thinks we’re going to be best friends. I think I have a big thing for him, and the more I get to know him, the more I don’t care that I’m not allowed to be his friend, let alone fall for him.
The thing is, that’s exactly what I’m doing—what we’re doing, I think.

Falling.
Hard. (less)",sports
85,Booked,4.19,Kwame Alexander,"16,987","2,692","2,434 followers","National Book Award Long List
New York Times Bestseller 

Like lightning/you strike/fast and free/legs zoom/down field/eyes fixed/on the checkered ball/on the goal/ten yards to go/can’t nobody stop you/
can’t nobody cop you…
In this follow-up to the Newbery-winning novel THE CROSSOVER,  soccer, family, love, and friendship, take center stage as twelve-year-old Nick learns the power of words as he wrestles with problems at home, stands up to a bully, and tries to impress the girl of his dreams. Helping him along are his best friend and sometimes teammate Coby, and The Mac, a rapping librarian who gives Nick inspiring books to read.  
This electric and heartfelt novel-in-verse by poet Kwame Alexander bends and breaks as it captures all the thrills and setbacks, action and emotion of a World Cup match! (less)",sports
86,Wrecking Ball,4.11,P. Dangelico,"14,505","1,374","3,421 followers","An older version of this ASIN can be found here


Cam DeSantis’ life is a mess. How else would you describe losing your husband, your job, and your money all at once? Desperate times call for desperate measures. So when salvation comes in the form of one intolerable jerk, she has no choice but to accept his offer as a nanny for his eight year old nephew. Now all she has to do is find a way to ignore him for the next three months. Which is easier said than done.


NFL quarterback Calvin Shaw has zero interest in women. It’s not that he doesn’t like women. In fact, he loves women. He just doesn’t want anything to do with them. What he needs to do is focus on winning another Super Bowl before he retires. Problem is, the woman living in his house is a major distraction. And he doesn’t know what’s worse, that he promised to be civil, or that he’s attracted to her.

Best laid plans are going to get wrecked when a reclusive football star is forced to live with a reluctant nanny. (less)",sports
87,"Dream Team: How Michael, Magic, Larry, Charles, and the Greatest Team of All Time Conquered the World and Changed the Game of Basketball Forever",4.21,Jack McCallum,"12,338",535,69 followers,"They were the Beatles of basketball, the Mercury Seven in sneakers.
 
In Dream Team, acclaimed sports journalist Jack McCallum delivers the untold story of the greatest team ever assembled: the 1992 U.S. Olympic Men’s Basketball Team that captivated the world, kindled the hoop dreams of countless children around the planet, and remade the NBA into a global sensation.
 
As a senior staff writer for Sports Illustrated, McCallum enjoyed a courtside seat for the most exciting basketball spectacle on earth, covering the Dream Team from its inception to the gold medal ceremony in Barcelona. For the duration of the Olympics, he lived with, golfed with, and—most important—drank with some of the greatest players of the NBA’s Golden Age: Magic Johnson, the ebullient showman who shrugged off his recent diagnosis of HIV to become the team’s unquestioned captain and leader; Michael Jordan, the transcendent talent at the height of his powers as a player—and a marketing juggernaut; and Charles Barkley, the outspoken iconoclast whose utterances on and off the court threatened to ignite an international incident. Presiding over the entire traveling circus was the Dream Team’s beloved coach, Chuck Daly, whose laissez-faire approach proved instrumental in getting the most out of such disparate personalities and superstars such as Larry Bird, Patrick Ewing, and Scottie Pippen.
 
Drawing on fresh interviews with the players, McCallum provides the definitive account of the Dream Team phenomenon. He offers a behind-the-scenes look at the controversial selection process. He takes us inside the team’s Olympic suites for late-night card games and bull sessions where the players debate both the finer points of basketball and their respective places in the NBA pantheon. And he narrates a riveting possession-by-possession account of the legendary July 1992 intrasquad scrimmage that pitted the Dream Teamers against one another in what may have been the greatest pickup game—and the greatest exhibition of trash talk—in history.
 
In the twenty years since the Dream Team first captivated the world’s attention, its mystique has only grown—and so has its influence. The NBA is now flush with international stars, many of them inspired by the exuberant spirit of ’92. Dream Team vividly re-creates the moment when a once-in-a-millennium group of athletes came together, outperformed the hype, and changed the future of sports—one perfectly executed fast break at a time.
 
The Dream Team was . . .
 
Michael Jordan, Guard, Chicago Bulls
Magic Johnson, Guard, Los Angeles Lakers
Larry Bird, Forward, Boston Celtics
Charles Barkley, Forward, Phoenix Suns
Chris Mullin, Forward, Golden State Warriors
Scottie Pippen, Forward, Chicago Bulls
John Stockton, Guard, Utah Jazz
Karl Malone, Forward, Utah Jazz
David Robinson, Center, San Antonio Spurs
Patrick Ewing, Center, New York Knicks
Christian Laettner, Forward, Duke University
Clyde Drexler, Guard, Portland Trailblazers (less)",sports
