,title,rating,name,num_ratings,num_reviews,num_followers,synopsis
33,Annihilation,3.74,Jeff VanderMeer,"190,821","21,103","12,318 followers","Area X has been cut off from the rest of the world for decades. Nature has reclaimed the last vestiges of human civilization. The first expedition returned with reports of a pristine, Edenic landscape; the second expedition ended in mass suicide, the third in a hail of gunfire as its members turned on one another. The members of the eleventh expedition returned as shadows of their former selves, and within weeks, all had died of cancer. In Annihilation, the first volume of Jeff VanderMeer's Southern Reach Trilogy, we join the twelfth expedition.

The group is made up of four women: an anthropologist; a surveyor; a psychologist, the de facto leader; and our narrator, a biologist. Their mission is to map the terrain, record all observations of their surroundings and of one another, and, above all, avoid being contaminated by Area X itself.

They arrive expecting the unexpected, and Area X delivers—but it’s the surprises that came across the border with them and the secrets the expedition members are keeping from one another that change everything. (less)"
34,Anna Dressed in Blood,3.91,Kendare Blake,"103,417","10,306","54,567 followers","Cas Lowood has inherited an unusual vocation: He kills the dead.

So did his father before him, until he was gruesomely murdered by a ghost he sought to kill. Now, armed with his father's mysterious and deadly athame, Cas travels the country with his kitchen-witch mother and their spirit-sniffing cat. They follow legends and local lore, destroy the murderous dead, and keep pesky things like the future and friends at bay.

Searching for a ghost the locals call Anna Dressed in Blood, Cas expects the usual: track, hunt, kill. What he finds instead is a girl entangled in curses and rage, a ghost like he's never faced before. She still wears the dress she wore on the day of her brutal murder in 1958: once white, now stained red and dripping with blood. Since her death, Anna has killed any and every person who has dared to step into the deserted Victorian she used to call home.

Yet she spares Cas's life. (less)"
35,Welcome to Lovecraft,4.15,Joe Hill,"91,350","6,045","23,882 followers","Locke & Key tells of Keyhouse, an unlikely New England mansion, with fantastic doors that transform all who dare to walk through them. Home to a hate-filled and relentless creature that will not rest until it forces open the most terrible door of them all..."
36,I'm Thinking of Ending Things,3.60,Iain Reid,"109,817","20,290","2,567 followers","Now a Netflix original movie, this deeply scary and intensely unnerving novel follows a couple in the midst of a twisted unraveling of the darkest unease. You will be scared. But you won’t know why…

I’m thinking of ending things. Once this thought arrives, it stays. It sticks. It lingers. It’s always there. Always.

Jake once said, “Sometimes a thought is closer to truth, to reality, than an action. You can say anything, you can do anything, but you can’t fake a thought.”

And here’s what I’m thinking: I don’t want to be here.

In this smart and intense literary suspense novel, Iain Reid explores the depths of the human psyche, questioning consciousness, free will, the value of relationships, fear, and the limitations of solitude. Reminiscent of Jose Saramago’s early work, Michel Faber’s cult classic Under the Skin, and Lionel Shriver’s We Need to Talk about Kevin, “your dread and unease will mount with every passing page” (Entertainment Weekly) of this edgy, haunting debut. Tense, gripping, and atmospheric, I’m Thinking of Ending Things pulls you in from the very first page…and never lets you go. (less)"
37,The Cabin at the End of the World,3.31,Paul Tremblay,"47,206","7,779","7,185 followers","Seven-year-old Wen and her parents, Eric and Andrew, are vacationing at a remote cabin on a quiet New Hampshire lake. Their closest neighbors are more than two miles in either direction along a rutted dirt road.

One afternoon, as Wen catches grasshoppers in the front yard, a stranger unexpectedly appears in the driveway. Leonard is the largest man Wen has ever seen but he is young, friendly, and he wins her over almost instantly. Leonard and Wen talk and play until Leonard abruptly apologizes and tells Wen, ""None of what’s going to happen is your fault"". Three more strangers then arrive at the cabin carrying unidentifiable, menacing objects. As Wen sprints inside to warn her parents, Leonard calls out: ""Your dads won’t want to let us in, Wen. But they have to. We need your help to save the world."" (less)"
38,Duma Key,3.96,Stephen King,"113,083","6,265","798,942 followers","From the Flap:

NO MORE THAN A DARK PENCIL LINE ON A BLANK PAGE. A HORIZON LINE, MAYBE, BUT ALSO A SLOT FOR BLACKNESS TO POUR THROUGH . . .

A terrible construction site accident takes Edgar Freemantle's right arm and scrambles his memory and his mind, leaving him with little but rage as he begins the ordeal of rehabilitation. A marriage that produced two lovely daughters suddenly ends, and Edgar begins to wish he hadn't survived the injuries that could have killed him. He wants out. His psychologist, Dr. Kamen, suggests a ""geographic cure,"" a new life distant from the Twin Cities and the building business Edgar grew from scratch. And Kamen suggests something else.

""Edgar does anything make you happy?""

""I used to sketch.""

""Take it up again. You need hedges . . .

hedges against the night.""

Edgar leaves Minnesota for a rented house on Duma Key, a stunningly beautiful, eerily undeveloped splinter of the Florida coast. The sun setting into the Gulf of Mexico and the tidal rattling of shells on the beach call out to him, and Edgar draws. A visit from Ilse, the daughter he dotes on, starts his movement out of solitude. He meets a kindred spirit in Wireman, a man reluctant to reveal his own wounds, and then Elizabeth Eastlake, a sick old woman whose roots are tangled deep in Duma Key. Now Edgar paints, sometimes feverishly, his exploding talent both a wonder and a weapon. Many of his paintings have a power that cannot be controlled. When Elizabeth's past unfolds and the ghosts of her childhood begin to appear, the damage of which they are capable is truly devastating.

The tenacity of love, the perils of creativity, the mysteries of memory and the nature of the supernatural--Stephen King gives us a novel as fascinating as it is gripping and terrifying. (less)"
39,Nightmares and Dreamscapes,3.95,Stephen King,"78,289","1,591","798,942 followers","A solitary finger pokes out of a drain. Novelty teeth turn predatory. The Nevada desert swallows a Cadillac. Meanwhile, the legend of Castle Rock returns... and grows on you. What does it all mean? What else could it mean? Stephen King is back with a powerful new collection of stories - a vast, many-chambered cave of a volume.

In story after story, the long reach of Stephen King's imagination and the no-holds-barred force of his storytelling will take you to places you've never been before. On a roller-coaster through the macabre and the monstrous, via cutting-edge explorations of good and evil - and onto a heartfelt piece on Little League baseball.

You will lose a good deal of sleep. But Stephen King, writing to beat the devil, will do your dreaming for you... (less)"
40,Tender is the Flesh,3.90,Agustina Bazterrica,"64,478","14,331",743 followers,"Working at the local processing plant, Marcos is in the business of slaughtering humans —though no one calls them that anymore.

His wife has left him, his father is sinking into dementia, and Marcos tries not to think too hard about how he makes a living. After all, it happened so quickly. First, it was reported that an infectious virus has made all animal meat poisonous to humans. Then governments initiated the “Transition.” Now, eating human meat—“special meat”—is legal. Marcos tries to stick to numbers, consignments, processing.

Then one day he’s given a gift: a live specimen of the finest quality. Though he’s aware that any form of personal contact is forbidden on pain of death, little by little he starts to treat her like a human being. And soon, he becomes tortured by what has been lost—and what might still be saved. (less)"
41,The Talisman,4.13,Stephen King,"118,254","4,110","798,942 followers","Two of the world's bestselling authors have combined their unique talents in an unforgettable epic of fantasy, adventure, odyssey - and spine-tingling terror.

You are about to take a journey... a terrifying trip across America where young Jack Sawyer is searching for the Talisman, the only thing that can save his dying mother. His quest takes him into the menacing Territories where violence, surprise and the titanic struggle between good and evil reach across a mythic landscape... a journey into the dark heart of horror. (less)"
42,Rose Madder,3.73,Stephen King,"105,437","3,268","798,942 followers","Roused by a single drop of blood, Rosie Daniels wakes up to the chilling realisation that her husband is going to kill her. And she takes flight – with his credit card.

Alone in a strange city, Rosie begins to build a new life: she meets Bill Steiner and she finds an old junk shop painting, ""Rose Madder,"" which strangely seems to want her as much as she wants it.

But it’s hard for Rosie not to keep looking over her shoulder. Rose-maddened and on the rampage, Norman is a corrupt cop with a dog’s instinct for tracking people. And he’s getting close. Rosie can feel just how close he is getting…

A brilliant dark-hued fable of gender wars, a haunting love story, and a hold-your-breath triumph of suspense, ""Rose Madder"" is Stephen King at his electrifying best. (less)"
43,Dolores Claiborne,3.90,Stephen King,"139,493","3,963","798,942 followers","Suspected of killing Vera Donovan, her wealthy employer, Dolores Claiborne tells police the story of her life, harkening back to her disintegrating marriage and the suspicious death of her violent husband, Joe St. George, thirty years earlier. Dolores also tells of Vera's physical and mental decline and of her loyalty to an employer who has become emotionally demanding in recent years. (less)"
44,Home Before Dark,4.09,Riley Sager,"122,612","17,643","18,631 followers","What was it like? Living in that house.

Maggie Holt is used to such questions. Twenty-five years ago, she and her parents, Ewan and Jess, moved into Baneberry Hall, a rambling Victorian estate in the Vermont woods. They spent three weeks there before fleeing in the dead of night, an ordeal Ewan later recounted in a nonfiction book called House of Horrors. His tale of ghostly happenings and encounters with malevolent spirits became a worldwide phenomenon, rivaling The Amityville Horror in popularity—and skepticism.

Today, Maggie is a restorer of old homes and too young to remember any of the events mentioned in her father’s book. But she also doesn’t believe a word of it. Ghosts, after all, don’t exist. When Maggie inherits Baneberry Hall after her father’s death, she returns to renovate the place to prepare it for sale. But her homecoming is anything but warm. People from the past, chronicled in House of Horrors, lurk in the shadows. And locals aren’t thrilled that their small town has been made infamous thanks to Maggie’s father. Even more unnerving is Baneberry Hall itself—a place filled with relics from another era that hint at a history of dark deeds. As Maggie experiences strange occurrences straight out of her father’s book, she starts to believe that what he wrote was more fact than fiction.

In the latest thriller from New York Times bestseller Riley Sager, a woman returns to the house made famous by her father’s bestselling horror memoir. Is the place really haunted by evil forces, as her father claimed? Or are there more earthbound—and dangerous—secrets hidden within its walls? (less)"
45,The Queen of the Damned,3.90,Anne Rice,"145,161","2,563","23,631 followers","Librarian's note: An alternate cover edition can be found here

In 1976, a uniquely seductive world of vampires was unveiled in the now-classic Interview with the Vampire . . . in 1985, a wild and voluptous voice spoke to us, telling the story of The Vampire Lestat.  In The Queen of the Damned, Anne Rice continues her extraordinary ""Vampire Chronicles"" in a feat of mesmeric storytelling, a chillingly hypnotic entertainment in which the oldest and most powerful forces of the night are unleashed on an unsuspecting world.

Three brilliantly colored narrative threads intertwine as the story unfolds:

- The rock star known as Vampire Lestat, worshipped by millions of spellbound fans, prepares for a concert in San Francisco.  Among the audience--pilgrims in a blind swoon of adoration--are hundreds of vampires, creatures who see Lestat as a ""greedy fiend risking the secret prosperity of all his kind just to be loved and seen by mortals,"" fiends themselves who hate Lestat's power and who are determined to destroy him . . .

- The sleep of certain men and women--vampires and mortals scattered around the world--is haunted by a vivid, mysterious dream: of twins with fiery red hair and piercing green eyes who suffer an unspeakable tragedy.  It is a dream that slowly, tauntingly reveals its meaning to the dreamers as they make their way toward each other--some to be destroyed on the journey, some to face an even more terrifying fate at journey's end . . .

- Akasha--Queen of the Damned, mother of all vampires, rises after a 6,000 year sleep and puts into motion a heinous plan to ""save"" mankind from itself and make ""all myths of the world real"" by elevating herself and her chosen son/lover to the level of the gods: ""I am the fulfillment and I shall from this moment be the cause"" . . .

These narrative threads wind sinuously across a vast, richly detailed tapestry of the violent, sensual world of vampirism, taking us back 6,000 years to its beginnings.  As the stories of the ""first brood"" of blood drinkers are revealed, we are swept across the ages, from Egypt to South America to the Himalayas to all the shrouded corners of the globe where vampires have left their mark. Vampires are created--mortals succumbing to the sensation of ""being enptied, of being devoured, of being nothing."" Vampires are destroyed.  Dark rituals are performed--the rituals of ancient creatures prowling the modern world.  And, finally, we are brought to a moment in the twentieth century when, in an astonishing climax, the fate of the living dead--and perhaps of the living, all the living--will be decided.


From the Hardcover edition. (less)"
46,Wilder Girls,3.49,Rory Power,"68,716","13,002","2,553 followers","It's been eighteen months since the Raxter School for Girls was put under quarantine. Since the Tox hit and pulled Hetty's life out from under her.

It started slow. First the teachers died one by one. Then it began to infect the students, turning their bodies strange and foreign. Now, cut off from the rest of the world and left to fend for themselves on their island home, the girls don't dare wander outside the school's fence, where the Tox has made the woods wild and dangerous. They wait for the cure they were promised as the Tox seeps into everything.

But when Byatt goes missing, Hetty will do anything to find her, even if it means breaking quarantine and braving the horrors that lie beyond the fence. And when she does, Hetty learns that there's more to their story, to their life at Raxter, than she could have ever thought true. (less)"
47,John Dies at the End,3.89,David Wong,"67,748","6,818","4,894 followers","STOP. You should not have touched this flyer with your bare hands. NO, don't put it down. It's too late. They're watching you. My name is David Wong. My best friend is John. Those names are fake. You might want to change yours. You may not want to know about the things you'll read on these pages, about the sauce, about Korrok, about the invasion, and the future. But it's too late. You touched the book. You're in the game. You're under the eye. The only defense is knowledge. You need to read this book, to the end. Even the part with the bratwurst. Why? You just have to trust me.

The important thing is this: The drug is called Soy Sauce and it gives users a window into another dimension. John and I never had the chance to say no. You still do. I'm sorry to have involved you in this, I really am. But as you read about these terrible events and the very dark epoch the world is about to enter as a result, it is crucial you keep one thing in mind: None of this was my fault. (less)"
48,The Ballad of Black Tom,3.89,Victor LaValle,"21,486","3,343","2,014 followers","People move to New York looking for magic and nothing will convince them it isn't there.

Charles Thomas Tester hustles to put food on the table, keep the roof over his father's head, from Harlem to Flushing Meadows to Red Hook. He knows what magic a suit can cast, the invisibility a guitar case can provide, and the curse written on his skin that attracts the eye of wealthy white folks and their cops. But when he delivers an occult tome to a reclusive sorceress in the heart of Queens, Tom opens a door to a deeper realm of magic, and earns the attention of things best left sleeping.

A storm that might swallow the world is building in Brooklyn. Will Black Tom live to see it break? (less)"
49,Bunny,3.58,Mona Awad,"59,805","14,638","2,046 followers","Samantha Heather Mackey couldn't be more of an outsider in her small, highly selective MFA program at New England's Warren University. A scholarship student who prefers the company of her dark imagination to that of most people, she is utterly repelled by the rest of her fiction writing cohort--a clique of unbearably twee rich girls who call each other ""Bunny,"" and seem to move and speak as one.

But everything changes when Samantha receives an invitation to the Bunnies' fabled ""Smut Salon,"" and finds herself inexplicably drawn to their front door--ditching her only friend, Ava, in the process. As Samantha plunges deeper and deeper into the Bunnies' sinister yet saccharine world, beginning to take part in the ritualistic off-campus ""Workshop"" where they conjure their monstrous creations, the edges of reality begin to blur. Soon, her friendships with Ava and the Bunnies will be brought into deadly collision.

The spellbinding new novel from one of our most fearless chroniclers of the female experience, Bunny is a down-the-rabbit-hole tale of loneliness and belonging, friendship and desire, and the fantastic and terrible power of the imagination. (less)"
50,The Graveyard Book,4.14,Neil Gaiman,"494,345","35,747","291,231 followers","Nobody Owens, known to his friends as Bod, is a perfectly normal boy. Well, he would be perfectly normal if he didn't live in a graveyard, being raised and educated by ghosts, with a solitary guardian who belongs to neither the world of the living nor the world of the dead.

There are dangers and adventures for Bod in the graveyard: the strange and terrible menace of the Sleer; a gravestone entrance to a desert that leads to the city of ghouls; friendship with a witch, and so much more.

But it is in the land of the living that real danger lurks, for it is there that the man Jack lives and he has already killed Bod's family.

A deliciously dark masterwork by bestselling author Neil Gaiman, with illustrations by award-winning Dave McKean. (less)"
51,Lovecraft Country,4.03,Matt Ruff,"38,481","4,773","2,080 followers","The critically acclaimed cult novelist makes visceral the terrors of life in Jim Crow America and its lingering effects in this brilliant and wondrous work of the imagination that melds historical fiction, pulp noir, and Lovecraftian horror and fantasy.

Chicago, 1954. When his father Montrose goes missing, twenty-two year old Army veteran Atticus Turner embarks on a road trip to New England to find him, accompanied by his Uncle George—publisher of The Safe Negro Travel Guide—and his childhood friend Letitia. On their journey to the manor of Mr. Braithwhite—heir to the estate that owned Atticus’s great grandmother—they encounter both mundane terrors of white America and malevolent spirits that seem straight out of the weird tales George devours.

At the manor, Atticus discovers his father in chains, held prisoner by a secret cabal named the Order of the Ancient Dawn—led by Samuel Braithwhite and his son Caleb—which has gathered to orchestrate a ritual that shockingly centers on Atticus. And his one hope of salvation may be the seed of his—and the whole Turner clan’s—destruction.

A chimerical blend of magic, power, hope, and freedom that stretches across time, touching diverse members of one black family, Lovecraft Country is a devastating kaleidoscopic portrait of racism—the terrifying specter that continues to haunt us today. (less)"
52,At the Mountains of Madness,3.84,H.P. Lovecraft,"43,963","3,482","15,703 followers","Long acknowledged as a master of nightmarish vision, H.P. Lovecraft established the genuineness and dignity of his own pioneering fiction in 1931 with his quintessential work of supernatural horror, At the Mountains of Madness. The deliberately told and increasingly chilling recollection of an Antarctic expedition's uncanny discoveries --and their encounter with an untold menace in the ruins of a lost civilization--is a milestone of macabre literature.

This Definitive Edition of At the Mountains of Madness (The Modern Library) also includes Lovecraft's long essay ""Supernatural Horror in Literature."" (less)"
53,Feed,3.85,Mira Grant,"56,123","6,640","5,027 followers","The year was 2014. We had cured cancer. We had beaten the common cold. But in doing so we created something new, something terrible that no one could stop.

The infection spread, virus blocks taking over bodies and minds with one, unstoppable command: FEED. Now, twenty years after the Rising, bloggers Georgia and Shaun Mason are on the trail of the biggest story of their lives—the dark conspiracy behind the infected.

The truth will get out, even if it kills them. (less)"
54,Hex,3.73,Thomas Olde Heuvelt,"27,726","4,584","1,827 followers","The English language debut of the bestselling Dutch novel, Hex, from Thomas Olde Heuvelt--a Hugo and World Fantasy award nominated talent to watch

Whoever is born here, is doomed to stay 'til death. Whoever settles, never leaves.

Welcome to Black Spring, the seemingly picturesque Hudson Valley town haunted by the Black Rock Witch, a seventeenth century woman whose eyes and mouth are sewn shut. Muzzled, she walks the streets and enters homes at will. She stands next to children's bed for nights on end. Everybody knows that her eyes may never be opened or the consequences will be too terrible to bear.

The elders of Black Spring have virtually quarantined the town by using high-tech surveillance to prevent their curse from spreading. Frustrated with being kept in lockdown, the town's teenagers decide to break their strict regulations and go viral with the haunting. But, in so doing, they send the town spiraling into dark, medieval practices of the distant past.

This chilling novel heralds the arrival of an exciting new voice in mainstream horror and dark fantasy. (less)"
55,The Hollow Places,3.80,T. Kingfisher,"16,962","3,409","4,739 followers","A young woman discovers a strange portal in her uncle’s house, leading to madness and terror in this gripping new novel.

Pray they are hungry.

Kara finds these words in the mysterious bunker that she’s discovered behind a hole in the wall of her uncle’s house. Freshly divorced and living back at home, Kara now becomes obsessed with these cryptic words and starts exploring the peculiar bunker—only to discover that it holds portals to countless alternate realities. But these places are haunted by creatures that seem to hear thoughts…and the more you fear them, the stronger they become. (less)"
56,The Twisted Ones,3.64,T. Kingfisher,"17,059","2,927","4,739 followers","When a young woman clears out her deceased grandmother’s home in rural North Carolina, she finds long-hidden secrets about a strange colony of beings in the woods.

When Mouse’s dad asks her to clean out her dead grandmother's house, she says yes. After all, how bad could it be?

Answer: pretty bad. Grandma was a hoarder, and her house is stuffed with useless rubbish. That would be horrific enough, but there’s more—Mouse stumbles across her step-grandfather’s journal, which at first seems to be filled with nonsensical rants…until Mouse encounters some of the terrifying things he described for herself.

Alone in the woods with her dog, Mouse finds herself face to face with a series of impossible terrors—because sometimes the things that go bump in the night are real, and they’re looking for you. And if she doesn’t face them head on, she might not survive to tell the tale.

From Hugo Award–winning author Ursula Vernon, writing as T. Kingfisher. (less)"
