,title,rating,name,num_ratings,num_reviews,num_followers,synopsis
57,My Heart Is a Chainsaw,3.60,Stephen Graham Jones,"17,875","4,206","6,129 followers","In her quickly gentrifying rural lake town Jade sees recent events only her encyclopedic knowledge of horror films could have prepared her for

Jade Daniels is an angry, half-Indian outcast with an abusive father, an absent mother, and an entire town that wants nothing to do with her. She lives in her own world, a world in which protection comes from an unusual source: horror movies…especially the ones where a masked killer seeks revenge on a world that wronged them. And Jade narrates the quirky history of Proofrock as if it is one of those movies. But when blood actually starts to spill into the waters of Indian Lake, she pulls us into her dizzying, encyclopedic mind of blood and masked murderers, and predicts exactly how the plot will unfold.

Yet, even as Jade drags us into her dark fever dream, a surprising and intimate portrait emerges… a portrait of the scared and traumatized little girl beneath the Jason Voorhees mask: angry, yes, but also a girl who easily cries, fiercely loves, and desperately wants a home. A girl whose feelings are too big for her body.

My Heart Is a Chainsaw is her story, her homage to horror and revenge and triumph. (less)"
58,Sleeping Beauties,3.73,Stephen King,"75,224","8,117","798,942 followers","In a future so real and near it might be now, something happens when women go to sleep; they become shrouded in a cocoon-like gauze.

If they are awakened, and the gauze wrapping their bodies is disturbed or violated, the women become feral and spectacularly violent; and while they sleep they go to another place.

The men of our world are abandoned, left to their increasingly primal devices. One woman, however, the mysterious Evie, is immune to the blessing or curse of the sleeping disease.

Is Evie a medical anomaly to be studied, or is she a demon who must be slain? (less)"
59,The Call of Cthulhu and Other Weird Stories,4.18,H.P. Lovecraft,"43,198","1,833","15,703 followers","This collection spans Lovecraft’s literary career, and charts the development of his ‘cosmicist’ philosophy; the belief that behind the veil of our blinkered everyday lives lies another reality, too terrible for the human mind to comprehend. In stories written in the gothic tradition, narrators recount their descent into madness and despair. Through their investigations into the unexplained, they tug at the thin threads that separate our world from another of indescribable horror. ‘“ Great God! I never dreamed of THIS!”’ screams occultist Harley Warren in ‘The Statement of Randolph Carter’, as he begs his companion to bury him alive. Another early piece, ‘The Outsider’ – a tragic and emotive evocation of loneliness and desolation – follows a man’s escape from his castle in a desperate search for human contact, but the loathsome truth he discovers destroys his mind.

In later tales, such as the iconic ‘The Call of Cthulhu’ and ‘The Whisperer in Darkness’, Lovecraft reaches into the cosmos, bridging the divide between horror and science fiction. The extra-terrestrial ‘gods’ and cursed histories that would emerge from these stories now form the cornerstones of Lovecraft’s unique mythology: the Cthulhu Mythos. This fictional universe, built in large part by his friend and most ardent supporter August Derleth, has in the years since been reimagined in myriad forms, and continues to act as a haunted playground for countless illustrators, fans and authors.

This edition, based on its sister limited edition, marries Lovecraft’s best-known fiction with two modern masters of the macabre, the acclaimed artist Dan Hillier and author Alan Moore. In his beautifully crafted new preface, Moore finds Lovecraft at once at odds with and integral to the time in which he lived: ‘the improbable embodiment of an estranged world in transition’. Yet, despite his prejudices and parochialisms, he ‘possessed a voice and a perspective both unique in modern literature’.

Hillier’s six mesmerising, portal-like illustrations embrace the alien realities that lurk among the gambrel roofs of Lovecraft’s landscapes. By splicing Victorian portraits and lithographs with cosmic and Lovecraftian symbolism, each piece – like the stories themselves – pulls apart the familiar to reveal what lies beneath.

The edition itself shimmers with Lovecraft’s ‘unknown colours’, bound in purple and greens akin to both the ocean depths and mysteries from outer space. The cover is embossed with a mystical design by Hillier, while a monstrous eye stares blankly from the slipcase.

Content:
1. Dagon
2. The Statement of Randolph Carter
3. Facts Concerning the Late Arthur Jermyn and His Family
4. Celephaïs
5. Nyarlathotep
6. The Picture in the House
7. The Outsider
8. Herbert West -- Reanimator
9. The Hound
10. The Rats in the Walls
11. The Festival
12. He
13. Cool Air
14. The Call of Cthulhu
15. The Colour Out of Space
16. The Whisperer in Darkness
17. The Shadow Over Innsmouth
18. The Haunter of the Dark (less)"
60,The Last House on Needless Street,3.88,Catriona Ward,"44,413","8,736","1,857 followers","This is the story of a serial killer. A stolen child. Revenge. Death. And an ordinary house at the end of an ordinary street.

All these things are true. And yet they are all lies...

You think you know what's inside the last house on Needless Street. You think you've read this story before. That's where you're wrong.

In the dark forest at the end of Needless Street, lies something buried. But it's not what you think... (less)"
61,The Ocean at the End of the Lane,4.01,Neil Gaiman,"553,840","53,663","291,231 followers","Sussex, England. A middle-aged man returns to his childhood home to attend a funeral. Although the house he lived in is long gone, he is drawn to the farm at the end of the road, where, when he was seven, he encountered a most remarkable girl, Lettie Hempstock, and her mother and grandmother. He hasn't thought of Lettie in decades, and yet as he sits by the pond (a pond that she'd claimed was an ocean) behind the ramshackle old farmhouse, the unremembered past comes flooding back. And it is a past too strange, too frightening, too dangerous to have happened to anyone, let alone a small boy.

Forty years earlier, a man committed suicide in a stolen car at this farm at the end of the road. Like a fuse on a firework, his death lit a touchpaper and resonated in unimaginable ways. The darkness was unleashed, something scary and thoroughly incomprehensible to a little boy. And Lettie—magical, comforting, wise beyond her years—promised to protect him, no matter what.

A groundbreaking work from a master, The Ocean at the End of the Lane is told with a rare understanding of all that makes us human, and shows the power of stories to reveal and shelter us from the darkness inside and out. It is a stirring, terrifying, and elegiac fable as delicate as a butterfly's wing and as menacing as a knife in the dark. (less)"
62,Later,4.01,Stephen King,"97,420","11,254","798,942 followers","The son of a struggling single mother, Jamie Conklin just wants an ordinary childhood. But Jamie is no ordinary child. Born with an unnatural ability his mom urges him to keep secret, Jamie can see what no one else can see and learn what no one else can learn. But the cost of using this ability is higher than Jamie can imagine - as he discovers when an NYPD detective draws him into the pursuit of a killer who has threatened to strike from beyond the grave.

Later is Stephen King at his finest, a terrifying and touching story of innocence lost and the trials that test our sense of right and wrong. With echoes of King's classic novel It, Later is a powerful, haunting, unforgettable exploration of what it takes to stand up to evil in all the faces it wears. (less)"
63,The Drawing of the Three,4.22,Stephen King,"239,464","9,063","798,942 followers","While pursuing his quest for the Dark Tower through a world that is a nightmarishly distorted mirror image of our own, Roland, the last gunslinger, encounters three mysterious doorways on the beach. Each one enters into the life of a different person living in contemporary New York.

Here he links forces with the defiant young Eddie Dean and the beautiful, brilliant, and brave Odetta Holmes, in a savage struggle against underworld evil and otherworldly enemies.

Once again, Stephen King has masterfully interwoven dark, evocative fantasy and icy realism. (less)"
64,Nothing But Blackened Teeth,2.78,Cassandra Khaw,"17,574","4,181","1,113 followers","Cassandra Khaw's Nothing But Blackened Teeth is a gorgeously creepy haunted house tale, steeped in Japanese folklore and full of devastating twists.

A Heian-era mansion stands abandoned, its foundations resting on the bones of a bride and its walls packed with the remains of the girls sacrificed to keep her company.

It’s the perfect wedding venue for a group of thrill-seeking friends.

But a night of food, drinks, and games quickly spirals into a nightmare. For lurking in the shadows is the ghost bride with a black smile and a hungry heart.

And she gets lonely down there in the dirt. (less)"
65,If It Bleeds,4.01,Stephen King,"69,732","8,212","798,942 followers","If it Bleeds is a collection of four new novellas —Mr. Harrigan’s Phone, The Life of Chuck, Rat, and the title story If It Bleeds— each pulling readers into intriguing and frightening places.

A collection of four uniquely wonderful long stories, including a stand-alone sequel to The Outsider.

News people have a saying: 'If it bleeds, it leads'. And a bomb at Albert Macready Middle School is guaranteed to lead any bulletin.

Holly Gibney of the Finders Keepers detective agency is working on the case of a missing dog - and on her own need to be more assertive - when she sees the footage on TV. But when she tunes in again, to the late-night report, she realizes there is something not quite right about the correspondent who was first on the scene. So begins 'If It Bleeds' , a stand-alone sequel to The Outsider featuring the incomparable Holly on her first solo case.

Dancing alongside are three more long stories - 'Mr Harrigan's Phone', 'The Life of Chuck' and 'Rat' .

The novella is a form King has returned to over and over again in the course of his amazing career, and many have been made into iconic films, If It Bleeds is a uniquely satisfying collection of longer short fiction by an incomparably gifted writer. (less)"
66,Cycle of the Werewolf,3.66,Stephen King,"54,529","2,580","798,942 followers","The first scream came from the snowbound railwayman who felt the fangs ripping at his throat. The next month there was a scream of ecstatic agony from the woman attacked in her snug bedroom.

Now scenes of unbelieving horror come each time the full moon shines on the isolated Maine town of Tarker Mills. No one knows who will be attacked next. But one thing is sure.

When the moon grows fat, a paralyzing fear sweeps through Tarker Mills. For snarls that sound like human words can be heard whining through the wind. And all around are the footprints of a monster whose hunger cannot be sated... Cycle of the Werewolf. (less)"
67,Swan Song,4.28,Robert McCammon,"61,519","4,213","4,368 followers","An ancient evil roams the desolate landscape of an America ravaged by nuclear war.

He is the Man with the Scarlet Eye, a malevolent force that feeds on the dark desires of the countless followers he has gathered into his service. His only desire is to find a special child named Swan—and destroy her. But those who would protect the girl are determined to fight for what is left of the world, and their souls.

In a wasteland born of rage, populated by monstrous creatures and marauding armies, the last survivors on earth have been drawn into the final battle between good and evil that will decide the fate of humanity.... (less)"
68,20th Century Ghosts,3.93,Joe Hill,"38,389","3,159","23,883 followers","A collection of short stories.

Imogene is young and beautiful. She kisses like a movie star and knows everything about every film ever made. She's also dead and waiting in the Rosebud Theater for Alec Sheldon one afternoon in 1945....

Arthur Roth is a lonely kid with big ideas and a gift for attracting abuse. It isn't easy to make friends when you're the only inflatable boy in town....

Francis is unhappy. Francis was human once, but that was then. Now he's an eight-foot-tall locust and everyone in Calliphora will tremble when they hear him sing....

John Finney is locked in a basement that's stained with the blood of half a dozen other murdered children. In the cellar with him is an antique telephone, long since disconnected, but which rings at night with calls from the dead....

The past isn't dead. It isn't even past... (less)"
69,Odd Thomas,3.98,Dean Koontz,"262,885","7,933","32,563 followers","He's Odd. Odd Thomas, to be precise. Genius fry-cook at the Pico Mundo Grill; boyfriend to the gorgeous Stormy Llewellyn - and possibly the only person with a chance of stopping one of the worst crimes in the bloody history of murder...

Something evil has come to the desert town that Odd and Stormy call home. It comes in the form of a mysterious man with a macabre appetite, a filing cabinet full of information on the world's worst killers, and strange, hyena-like shadows following him wherever he goes. Odd is worried. He knows things, sees things - about the living, the dead, and the soon-to-be dead. Things that he has to act on. Now he's terrified for Stormy, himself and Pico Mundo. Because he knows that on Wednesday August 15, a savage, blood-soaked whirlwind of violence and murder will devastate the town...

Today is August 14.
And Odd is far from sure he can stop the coming storm... (less)"
70,The Fireman,3.91,Joe Hill,"56,144","7,483","23,883 followers","From the award-winning, New York Times bestselling author of NOS4A2 and Heart-Shaped Box comes a chilling novel about a worldwide pandemic of spontaneous combustion that threatens to reduce civilization to ashes and a band of improbable heroes who battle to save it, led by one powerful and enigmatic man known as the Fireman.

The fireman is coming. Stay cool.

No one knows exactly when it began or where it originated. A terrifying new plague is spreading like wildfire across the country, striking cities one by one: Boston, Detroit, Seattle. The doctors call it Draco Incendia Trychophyton. To everyone else it’s Dragonscale, a highly contagious, deadly spore that marks its hosts with beautiful black and gold marks across their bodies—before causing them to burst into flames. Millions are infected; blazes erupt everywhere. There is no antidote. No one is safe.

Harper Grayson, a compassionate, dedicated nurse as pragmatic as Mary Poppins, treated hundreds of infected patients before her hospital burned to the ground. Now she’s discovered the telltale gold-flecked marks on her skin. When the outbreak first began, she and her husband, Jakob, had made a pact: they would take matters into their own hands if they became infected. To Jakob’s dismay, Harper wants to live—at least until the fetus she is carrying comes to term. At the hospital, she witnessed infected mothers give birth to healthy babies and believes hers will be fine too. . . if she can live long enough to deliver the child.

Convinced that his do-gooding wife has made him sick, Jakob becomes unhinged, and eventually abandons her as their placid New England community collapses in terror. The chaos gives rise to ruthless Cremation Squads—armed, self-appointed posses roaming the streets and woods to exterminate those who they believe carry the spore. But Harper isn’t as alone as she fears: a mysterious and compelling stranger she briefly met at the hospital, a man in a dirty yellow fire fighter’s jacket, carrying a hooked iron bar, straddles the abyss between insanity and death. Known as The Fireman, he strolls the ruins of New Hampshire, a madman afflicted with Dragonscale who has learned to control the fire within himself, using it as a shield to protect the hunted . . . and as a weapon to avenge the wronged.

In the desperate season to come, as the world burns out of control, Harper must learn the Fireman’s secrets before her life—and that of her unborn child—goes up in smoke. (less)"
71,The Regulators,3.71,Richard Bachman,"78,248","1,751","3,491 followers","There's a place in Wentworth, Ohio, where summer is in full swing. It's called Poplar Street. Up until now it's been a nice place to live. The idling red van around the corner is about to change all that. Let the battle against evil begin. Here come...The Regulators (less)"
72,Imaginary Friend,3.53,Stephen Chbosky,"40,046","8,696","12,126 followers","Christopher is seven years old.
Christopher is the new kid in town.
Christopher has an imaginary friend.

We can swallow our fear or let our fear swallow us.

Single mother Kate Reese is on the run. Determined to improve life for her and her son, Christopher, she flees an abusive relationship in the middle of the night with her child. Together, they find themselves drawn to the tight-knit community of Mill Grove, Pennsylvania. It's as far off the beaten track as they can get. Just one highway in, one highway out.

At first, it seems like the perfect place to finally settle down. Then Christopher vanishes. For six long days, no one can find him. Until Christopher emerges from the woods at the edge of town, unharmed but not unchanged. He returns with a voice in his head only he can hear, with a mission only he can complete: Build a treehouse in the woods by Christmas, or his mother and everyone in the town will never be the same again.

Twenty years ago, Stephen Chbosky's The Perks of Being a Wallflower made readers everywhere feel infinite. Now, Chbosky has returned with an epic work of literary horror, years in the making, whose grand scale and rich emotion redefine the genre. Read it with the lights on. (less)"
73,Watchers,4.18,Dean Koontz,"159,568","4,559","32,563 followers","They escape from a secret government: two mutant creatures, both changed utterly from the animals they once were. And no one who encounters them will ever be the same again:

A lonely widower; a ruthless assassin; a beautiful woman; a government agent.

Drawn together in a deadly hunt, all four are inexorably propelled towards a confrontation with an evil beyond human imagining. (less)"
74,Psycho,4.11,Robert Bloch,"60,861","3,146","1,078 followers","It was a dark and stormy night when Mary Crane glimpsed the unlit neon sign announcing the vacancy at the Bates motel. Exhausted, lost, and at the end of her rope, she was eager for a hot shower and a bed for the night. Her room was musty but clean and the plumbing worked. Norman Bates, the manager, seemed nice, if a little odd."
75,Lisey's Story,3.70,Stephen King,"78,996","4,988","798,942 followers","Lisey Debusher Landon lost her husband, Scott, two years ago, after a twenty-five year marriage of the most profound and sometimes frightening intimacy. Scott was an award-winning, bestselling novelist and a very complicated man. Early in their relationship, before they married, Lisey had to learn from him about books and blood and bools. Later, she understood that there was a place Scott went--a place that both terrified and healed him, that could eat him alive or give him the ideas he needed in order to live. Now it's Lisey's turn to face Scott's demons, Lisey's turn to go to Boo'ya Moon. What begins as a widow's efforts to sort through the papers of her celebrated husband becomes a nearly fatal journey into the darkness he inhabited. Perhaps King's most personal and powerful novel, Lisey's Story is about the wellsprings of creativity, the temptations of madness, and the secret language of love.
(front flap) (less)"
76,Mr. Mercedes,3.99,Stephen King,"279,490","18,637","798,942 followers","In the predawn hours, in a distressed American city, hundreds of unemployed men and women line up for the opening of a job fair. They are tired and cold and desperate. Emerging from the fog, invisible until it is too late, a lone driver plows through the crowd in a stolen Mercedes, running over the innocent, backing up, and charging again. Eight people are killed; fifteen are wounded. The killer escapes.

Months later, an ex-cop named Bill Hodges, still haunted by the unsolved crime, contemplates suicide. When he gets a crazed letter from ""the perk,"" claiming credit for the murders, Hodges wakes up from his depressed and vacant retirement, fearing another even more diabolical attack and hell-bent on preventing it.

Brady Hartfield lives with his alcoholic mother in the house where he was born. He loved the feel of death under the wheels of the Mercedes, and he wants that rush again. Only Bill Hodges, with a couple of eccentric and mismatched allies, can apprehend the killer before he strikes again. And they have no time to lose, because Brady's next mission, if it succeeds, will kill or maim thousands.

Mr. Mercedes is a war between good and evil from the master of suspense whose insight into the mind of this obsessed, insane killer is chilling and unforgettable.
--front flap (less)"
77,Slade House,3.81,David Mitchell,"58,873","7,456","13,313 followers","Keep your eyes peeled for a small black iron door.

Down the road from a working-class British pub, along the brick wall of a narrow alley, if the conditions are exactly right, you’ll find the entrance to Slade House. A stranger will greet you by name and invite you inside. At first, you won’t want to leave. Later, you’ll find that you can’t. Every nine years, the house’s residents — an odd brother and sister — extend a unique invitation to someone who’s different or lonely: a precocious teenager, a recently divorced policeman, a shy college student. But what really goes on inside Slade House? For those who find out, it’s already too late...

Spanning five decades, from the last days of the 1970s to the present, leaping genres, and barreling toward an astonishing conclusion, this intricately woven novel will pull you into a reality-warping new vision of the haunted house story—as only David Mitchell could imagine it. (less)"
78,Scary Stories to Tell in the Dark,4.05,Alvin Schwartz,"62,393","3,340",561 followers,"This spooky addition to Alvin Schwartz's popular books on American folklore is filled with tales of eerie horror and dark revenge that will make you jump with fright.

There is a story here for everyone—skeletons with torn and tangled flesh who roam the earth; a ghost who takes revenge on her murderer; and a haunted house where every night a bloody head falls down the chimney.

Stephen Gammell's splendidly creepy drawings perfectly capture the mood of more than two dozen scary stories—and even scary songs—all just right for reading alone or for telling aloud in the dark.

If You Dare! (less)"
79,Pride and Prejudice and Zombies,3.31,Seth Grahame-Smith,"135,523","13,425","2,609 followers","“It is a truth universally acknowledged that a zombie in possession of brains must be in want of more brains.”

So begins Pride and Prejudice and Zombies, an expanded edition of the beloved Jane Austen novel featuring all-new scenes of bone-crunching zombie mayhem. As our story opens, a mysterious plague has fallen upon the quiet English village of Meryton—and the dead are returning to life! Feisty heroine Elizabeth Bennet is determined to wipe out the zombie menace, but she’s soon distracted by the arrival of the haughty and arrogant Mr. Darcy. What ensues is a delightful comedy of manners with plenty of civilized sparring between the two young lovers—and even more violent sparring on the blood-soaked battlefield. Can Elizabeth vanquish the spawn of Satan? And overcome the social prejudices of the class-conscious landed gentry? Complete with romance, heartbreak, swordfights, cannibalism, and thousands of rotting corpses, (less)"
