,title,rating,name,num_ratings,num_reviews,num_followers,synopsis,genre
20,The Book of Basketball: The NBA According to The Sports Guy,4.19,Bill Simmons,"34,028","1,069",326 followers,"There is only one writer on the planet who possesses enough basketball knowledge and passion to write the definitive book on the NBA.* Bill Simmons, the from-the-womb hoops addict known to millions as ESPN.com’s Sports Guy, is that writer. And The Book of Basketball is that book.

Nowhere in the roundball universe will you find another single volume that covers as much in such depth as this wildly opinionated and thoroughly entertaining look at the past, present, and future of pro basketball.

From the age-old question of who actually won the rivalry between Bill Russell and Wilt Chamberlain to the one about which team was truly the best of all time, Simmons opens–and then closes, once and for all–every major pro basketball debate. Then he takes it further by completely reevaluating not only how NBA Hall of Fame inductees should be chosen but how the institution must be reshaped from the ground up, the result being the Pyramid: Simmons’s one-of-a-kind, five-level shrine to the ninety-six greatest players in the history of pro basketball. And ultimately he takes fans to the heart of it all, as he uses a conversation with one NBA great to uncover that coveted thing: The Secret of Basketball.

Comprehensive, authoritative, controversial, hilarious, and impossible to put down (even for Celtic-haters), The Book of Basketball offers every hardwood fan a courtside seat beside the game’s finest, funniest, and fiercest chronicler.



* More to the point, he’s the only one crazy enough to try to pull it off.
(less)",sports
21,Ball Four,4.03,Jim Bouton,"18,353",879,58 followers,"Twentieth-anniversary edition of a baseball classic, with a new epilogue by Jim Bouton.

When first published in 1970, Ball Four stunned the sports world. The commissioner, executives, and players were shocked. Sportswriters called author Jim Bouton a traitor and ""social leper."" Baseball commissioner Bowie Kuhn tried to force him to declare the book untrue. Fans, however, loved the book. And serious critics called it an important social document. Today, Jim Bouton is still not invited to Oldtimer's Days at Yankee Stadium. But his landmark book is still being read by people who don't ordinarily follow baseball. (less)",sports
22,The Friend Zone,4.15,Kristen Callihan,"39,894","2,764","12,438 followers","Gray doesn’t make friends with women. He has sex with them. Until Ivy.

The last thing star tight-end Gray Grayson wants to do is drive his agent’s daughter’s bubblegum pink car. But he needs the wheels and she’s studying abroad. Something he explains when she sends him an irate text to let him know exactly how much pain she’ll put him in if he crashes her beloved ride. Before he knows it, Ivy Mackenzie has become his best texting bud. But then Ivy comes home and everything goes haywire. Because the only thing Gray can think of is being with Ivy.

Ivy doesn’t have sex with friends. Especially not with a certain football player. No matter how hot he makes her…

Gray drives Ivy crazy. He’s irreverent, sex on a stick, and completely off limits. Because, Ivy has one golden rule: never get involved with one of her father’s clients. A rule that’s proving harder to keep now that Gray is doing his best to seduce her. Her best friend is fast becoming the most irresistible guy she’s ever met.

Which means Gray is going to have to use all his skills to get himself out of the friend zone and into Ivy’s heart. Game on (less)",sports
23,The Perfect Play,3.9,Jaci Burton,"38,613","2,075","7,981 followers","Football pro Mick Riley is an all-star, both on the field and in the bedroom. But a sexy, determinedly single mom just might be the one to throw him off his game...

For years Mick has been taking full advantage of the life available to a pro athlete: fame, fortune, and a different girl in every city. But when he meets and beds confident, beautiful event planner Tara Lincoln, he wants much more than the typical one-night stand. Too bad Tara's not interested in getting to know football's most notorious playboy any better.

As the single mother of a teenage son, the last thing Tara needs is the jet-set lifestyle of Mick Riley; even though their steamy and passionate one-night stand was unforgettable. Tara's life is complicated enough without being thrust into the spotlight as Mick's latest girl du jour. Tara played the game of love once and lost big, and she doesn't intend to put herself out there again, especially with a heartbreaker like Mick.

But when Mick sets his mind to win, nothing will stop him. And he has the perfect play in mind. (less)",sports
24,The Risk,4.29,Elle Kennedy,"85,202","6,753","45,378 followers","A sexy standalone novel from New York Times and international bestselling author Elle Kennedy. THE RISK takes you back to the world of hot hockey players, feisty heroines, bro banter, and steamy scenes...

Everyone says I’m a bad girl. They’re only partly right—I don’t let fear rule me, and I certainly don’t care what people think. But I draw the line at sleeping with the enemy. As the daughter of Briar’s head hockey coach, I’d be vilified if I hooked up with a player from a rival team.

And that’s who Jake Connelly is. Harvard’s star forward is arrogant, annoying, and too attractive for his own good. But fate is cruel—I require his help to secure a much-coveted internship, and the sexy jerk isn’t making it easy for me.

I need Connelly to be my fake boyfriend.

For every fake date…he wants a real one.

Which means this bad girl is in big trouble. Nothing good can come from sneaking around with Jake Connelly. My father would kill me, my friends will revolt, and my post-college career is on the line. But while it’s getting harder and harder to resist Jake’s oozing sex appeal and cocky grin, I refuse to fall for him.

That’s the one risk I’m not willing to take. (less)",sports
25,The Game Plan,4.1,Kristen Callihan,"29,031","2,357","12,438 followers","A beard-related dare and one hot-as-hell kiss changes everything.

NFL center Ethan Dexter’s focus has always been on playing football and little else. Except when it comes to one particular woman. The lovely Fiona Mackenzie might not care about his fame, but she’s also never looked at him as anything more than one of her brother-in-law’s best friend. That ends now.

Fi doesn’t know what to make of Dex. The bearded, tattooed, mountain of man-muscle looks more like a biker than a football player. Rumor has it he’s a virgin, but she finds that hard to believe. Because from the moment he decides to turn his quiet intensity on her she’s left weak at the knees and aching to see his famous control fully unleashed.

Dex is looking for a forever girl, but they live vastly different lives in separate cities. Fi ought to guard her heart and walk away. But Dex has upped his game and is using all his considerable charm to convince Fi he's her forever man.

Game On (less)",sports
26,Beartown,4.27,Fredrik Backman,"3,03,151","35,035","52,195 followers","The #1 New York Times bestselling author of A Man Called Ove returns with a dazzling, profound novel about a small town with a big dream—and the price required to make it come true.

People say Beartown is finished. A tiny community nestled deep in the forest, it is slowly losing ground to the ever encroaching trees. But down by the lake stands an old ice rink, built generations ago by the working men who founded this town. And in that ice rink is the reason people in Beartown believe tomorrow will be better than today. Their junior ice hockey team is about to compete in the national semi-finals, and they actually have a shot at winning. All the hopes and dreams of this place now rest on the shoulders of a handful of teenage boys.

Being responsible for the hopes of an entire town is a heavy burden, and the semi-final match is the catalyst for a violent act that will leave a young girl traumatized and a town in turmoil. Accusations are made and, like ripples on a pond, they travel through all of Beartown, leaving no resident unaffected.

Beartown explores the hopes that bring a small community together, the secrets that tear it apart, and the courage it takes for an individual to go against the grain. In this story of a small forest town, Fredrik Backman has found the entire world. (less)",sports
27,Us,4.32,Sarina Bowen,"25,826","3,123","14,041 followers","Can your favorite hockey players finish their first season together undefeated?

Five months in, NHL forward Ryan Wesley is having a record-breaking rookie season. He’s living his dream of playing pro hockey and coming home every night to the man he loves—Jamie Canning, his longtime best friend turned boyfriend. There’s just one problem: the most important relationship of his life is one he needs to keep hidden, or else face a media storm that will eclipse his success on the ice.

Jamie loves Wes. He really, truly does. But hiding sucks. It’s not the life Jamie envisioned for himself, and the strain of keeping their secret is taking its toll. It doesn’t help that his new job isn’t going as smoothly as he’d hoped, but he knows he can power through it as long as he has Wes. At least apartment 10B is their retreat, where they can always be themselves.

Or can they?

When Wes’s nosiest teammate moves in upstairs, the threads of their carefully woven lie begin to unravel. With the outside world determined to take its best shot at them, can Wes and Jamie develop major-league relationship skills on the fly?

Warning: contains sexual situations, a vibrating chair, long-distance sexytimes and proof that hockey players look hot in any shade of green. (less)",sports
28,Ghost,4.22,Jason Reynolds,"38,472","5,658","8,130 followers","Running. That's all that Ghost (real name Castle Cranshaw) has ever known. But never for a track team. Nope, his game has always been ball. But when Ghost impulsively challenges an elite sprinter to a race—and wins—the Olympic medalist track coach sees he has something: crazy natural talent. Thing is, Ghost has something else: a lot of anger, and a past that he is trying to outrun. Can Ghost harness his raw talent for speed and meld with the team, or will his past finally catch up to him? (less)",sports
29,The Art of Fielding,3.98,Chad Harbach,"1,11,380","10,541",837 followers,"At Westish College, a small school on the shore of Lake Michigan, baseball star Henry Skrimshander seems destined for big league stardom. But when a routine throw goes disastrously off course, the fates of five people are upended.

Henry's fight against self-doubt threatens to ruin his future. College president Guert Affenlight, a longtime bachelor, has fallen unexpectedly and helplessly in love. Owen Dunne, Henry's gay roommate and teammate, becomes caught up in a dangerous affair. Mike Schwartz, the Harpooners' team captain and Henry's best friend, realizes he has guided Henry's career at the expense of his own. And Pella Affenlight, Guert's daughter, returns to Westish after escaping an ill-fated marriage, determined to start a new life.

As the season counts down to its climactic final game, these five are forced to confront their deepest hopes, anxieties, and secrets. In the process they forge new bonds, and help one another find their true paths. Written with boundless intelligence and filled with the tenderness of youth, The Art of Fielding is an expansive, warmhearted novel about ambition and its limits, about family and friendship and love, and about commitment - to oneself and to others. (less)",sports
30,The Foxhole Court,4.02,Nora Sakavic,"58,957","8,820","4,935 followers","Neil Josten is the newest addition to the Palmetto State University Exy team. He's short, he's fast, he's got a ton of potential—and he's the runaway son of the murderous crime lord known as The Butcher.

Signing a contract with the PSU Foxes is the last thing a guy like Neil should do. The team is high profile and he doesn't need sports crews broadcasting pictures of his face around the nation. His lies will hold up only so long under this kind of scrutiny and the truth will get him killed.

But Neil's not the only one with secrets on the team. One of Neil's new teammates is a friend from his old life, and Neil can't walk away from him a second time. Neil has survived the last eight years by running. Maybe he's finally found someone and something worth fighting for. (less)",sports
31,It Had to Be You,4.01,Susan Elizabeth Phillips,"64,208","2,662","14,190 followers","What if a woman who knows nothing about sports inherits a professional football team? The Windy City definitely isn't ready for Phoebe Somerville, the outrageous York knockout who’s taking over their home town team. And Phoebe is definitely not prepared for the Stars' head coach Dan Calebow, a sexist jock taskmaster with a one-track mind. This is the book that began it all. The Chicago Stars are about to take the field... and they’re not the only ones playing for keeps. (less)",sports
32,Seabiscuit: An American Legend,4.21,Laura Hillenbrand,"1,58,018","4,723","3,838 followers","There's an alternate cover edition here

Seabiscuit was one of the most electrifying and popular attractions in sports history and the single biggest newsmaker in the world in 1938, receiving more coverage than FDR, Hitler, or Mussolini. But his success was a surprise to the racing establishment, which had written off the crooked-legged racehorse with the sad tail. Three men changed Seabiscuit’s fortunes:

Charles Howard was a onetime bicycle repairman who introduced the automobile to the western United States and became an overnight millionaire. When he needed a trainer for his new racehorses, he hired Tom Smith, a mysterious mustang breaker from the Colorado plains. Smith urged Howard to buy Seabiscuit for a bargain-basement price, then hired as his jockey Red Pollard, a failed boxer who was blind in one eye, half-crippled, and prone to quoting passages from Ralph Waldo Emerson. Over four years, these unlikely partners survived a phenomenal run of bad fortune, conspiracy, and severe injury to transform Seabiscuit from a neurotic, pathologically indolent also-ran into an American sports icon.

Author Laura Hillenbrand brilliantly re-creates a universal underdog story, one that proves life is a horse race.


From the Hardcover edition. (less)",sports
33,Scoring Wilder,4.01,R.S. Grey,"31,279","2,503","10,942 followers","What started out as a joke— seduce Coach Wilder—soon became a goal she had to score.

With Olympic tryouts on the horizon, the last thing nineteen-year-old Kinsley Bryant needs to add to her plate is Liam Wilder. He's a professional soccer player, America's favorite bad-boy, and has all the qualities of a skilled panty-dropper.

• A face that makes girls weep – check.
• Abs that can shred Parmesan cheese (the expensive kind) – check.
• Enough confidence to shift the earth’s gravitational pull – double check.

Not to mention Liam is strictly off limits . Forbidden. Her coaches have made that perfectly clear. (i.e. “Score with Coach Wilder anywhere other than the field and you’ll be cut from the team faster than you can count his tattoos.”) But that just makes him all the more enticing…Besides, Kinsley's already counted the visible ones, and she is not one to leave a project unfinished.

Kinsley tries to play the game her way as they navigate through forbidden territory, but Liam is determined to teach her a whole new definition for the term “team bonding.”

A fun & sexy New Adult Romance (age 17+) (less)",sports
34,Taking Shots,3.91,Toni Aleo,"22,670","1,683","6,375 followers","Elli Fisher has never thought she was good enough, let it be her job, her weight, her love life, nothing. That is until she meets Shea Adler. After doing a promotional shoot for the NHL team, the Assassins, she meets the hunky hockey player who shoots a puck, shattering her world.
Shea Adler was tired of the life he was living outside of the rink. The girls, the money blowing, the drinking, everything had to stop and it all did when he met Eleanor Fisher. He had never met anyone like her. She was feisty, witty, shy, and simply gorgeous. When he laid eyes on her, it was as if he was taking the hardest hit of his life into the boards, and he had to have her. Elli is a little skeptical of Shea, but he knows that they were meant to be together, and he needed her in his life.
Can Elli throw her insecurities out the window and love Shea with everything inside of her, or will she let a past relationship, and her family ruin any chance of her being happy. (less)",sports
35,Enemies,4.04,Tijan,"41,910","3,909","22,189 followers","Stone Reeves was my neighbor, and I've hated him since sixth grade.

Gorgeous and charismatic, he became the town's football god, while I became the town's invisible girl.
He went to a Division 1 school for football, while my father was fired by his father.
His team won the National Championship, while my mother died the same day.

He was a first round pick for the NFL ...
... while I made the worst decision of my life.

Now I'm in Texas trying to pick up the pieces of my life.
But, Stone is here.
Stone is everywhere.

It doesn't matter that disaster has struck my life again.
It doesn't matter that he's the one trying to console me.
It doesn't matter that he's the nation's newest football obsession.

Because for me, he always has been and always will be my enemy.

** Enemies is a 100k enemies-to-lovers football romance standalone! (less)",sports
36,Good Boy,4.04,Sarina Bowen,"20,166","2,410","14,041 followers","Hosting her brother’s wedding for an MVP guest list is the challenge of Jess Canning’s life. Already the family screw-up, she can’t afford to fail. And nobody - absolutely nobody! - can learn of the colossal mistake she made with the best man during a weak moment last spring. It was wrong, and there will not be a repeat. Absolutely not. Even if he is the sexiest thing on two legs.

Blake Riley sees the wedding as fate’s gift to him. Jess is the maid of honor, and he’s the best man? Let the games begin. So what if he’s facing a little (fine, a lot) of resistance? He just needs to convince the stubborn blonde that he’s really a good boy with a bad rap. Luckily, every professional hockey player knows that you’ve got to make an effort if you want to score.

But Jess has more pressing issues to deal with than sexy-times with a giant man-child. Such as: Will the ceremony start on time, even though someone got grandma drunk? Does glitter ever belong at a wedding? And is it wrong to murder the best man?

Caution: May cause accidental aspiration of tea or coffee. Do not read in a public place where loud laughter is inappropriate. Contains hot but hilarious hockey players, puppy cuddling and a snarky pair of underwear. (less)",sports
37,Long Shot,4.22,Kennedy Ryan,"26,338","4,362","18,239 followers","A Standalone FORBIDDEN LOVE SET IN THE EXPLOSIVE WORLD OF THE NBA...

Think you know what it's like being a baller's girl?
You don't.
My fairy tale is upside down.
A happily never after.
I kissed the prince and he turned into a fraud.
I was a fool, and his love - fool's gold.

Now there's a new player in the game, August West.
One of the NBA's brightest stars.
Fine. Forbidden.
He wants me. I want him.
But my past, my fraudulent prince, just won't let me go.

*Contains domestic/sexual abuse not involving the hero. Read reviews for further guidance. (less)",sports
38,Sacked,3.99,Jen Frederick,"16,454","1,375","4,660 followers","What he wants he gets...

Knox Masters is a quarterback's worst nightmare. Warrior. Champion. And...virgin. Knox knows what he wants--and he gets it. All American Football player? Check. NFL pros scouting him? Check. Now, he's set his sight on two things. The national title. And Ellie Campbell. Sure, she's the sister of his fellow teammate, but that's not going to stop him. Especially not when he’s convinced Ellie is the one.

...but he's never met her before.

But Ellie isn't as sure. She's trying to start a new life and she's not interested in a relationship...with anyone. Beside it's not just her cardinal rule of never dating her brother's teammates that keeps her away, but Ellie has a dark secret that would jeopardize everything Knox is pursuing.

Knox has no intention of losing. Ellie has no intention of giving in. (less)",sports
39,The Hooker and the Hermit,3.91,L.H. Cosway,"26,802","2,676","5,734 followers","Book #1 in the USA TODAY BESTSELLING Rugby Series

New York’s Finest
Blogging as *The Socialmedialite*
April 22
LADIES AND GENTS! I have an announcement!

You know that guy I featured on my blog a few months ago? The really, really hot Irish rugby player who plays the position of ‘hooker’ in the RLI (Rugby League International)? The one with the anger management issues, the body of a gladiator and the face of a movie star? The one with the questionable fashion choices leading me to ask whether he was the lovechild of a leprechaun and a hobbit? Ronan Fitzpatrick? Yeah, that guy.

Well, I have a confession to make…

THE HERMIT

Annie Catrel, social media expert extraordinaire at Davidson & Croft Media and clandestine celebrity blogger, can make anyone shine in the court of public opinion. She is the Socialmedialite, anonymous creator of New York’s Finest and the internet’s darling. Virtual reality is Annie’s forte, but actual reality? Not so much.

THE HOOKER

Ronan Fitzpatrick, aka the best hooker the world of rugby has seen in decades, despises the media—social or otherwise. The press has spun a web of lies depicting him as rugby’s wild and reckless bad boy. Suspended from his team, Ronan has come to Manhattan to escape the drama, lay low, fly under the radar. Only, Ronan isn’t easy to overlook, and he can’t escape the notice of the Socialmedialite…

THE PLAN

When Ronan is sent to Davidson & Croft Media to reshape his public image, he never expects to cross paths with shy but beautiful Annie, nor does he expect his fierce attraction to her. He couldn’t be happier when her boss suggests pairing them together.

What lengths will Annie take to keep her virtual identity concealed? And what happens when the hooker discovers who the hermit really is? (less)",sports
40,The Year We Fell Down,3.96,Sarina Bowen,"28,023","2,827","14,041 followers","Alternate cover for this ASIN can be found here

The sport she loves is out of reach. The boy she loves has someone else. What now?
 
She expected to start Harkness College as a varsity ice hockey player. But a serious accident means that Corey Callahan will start school in a wheelchair instead.
 
Across the hall, in the other handicapped-accessible dorm room, lives the too-delicious-to-be real Adam Hartley, another would-be hockey star with his leg broken in two places. He's way out of Corey's league.
 
Also, he's taken.
 
Nevertheless, an unlikely alliance blooms between Corey and Hartley in McHerrin Hall. Over tequila, perilously balanced dining hall trays, and video games, the two cope with disappointments that nobody else understands.
 
They're just friends, of course, until one night when things fall apart. Or fall together. All Corey knows is that she's falling. Hard.
 
But will Hartley set aside his trophy girl to love someone as broken as Corey? If he won't, she will need to find the courage to make a life for herself at Harkness -- one which does not revolve around the sport she can no longer play, or the brown-eyed boy who's afraid to love her back. (less)",sports
41,The Boys of Summer,4.12,Roger Kahn,"11,194",474,55 followers,"This is a book about young men who learned to play baseball during the 1930s and 1940s, and then went on to play for one of the most exciting major-league ball clubs ever fielded, the team that broke the color barrier with Jackie Robinson. It is a book by and about a sportswriter who grew up near Ebbets Field, and who had the good fortune in the 1950s to cover the Dodgers for the Herald Tribune. This is a book about what happened to Jackie, Carl Erskine, Pee Wee Reese, and the others when their glory days were behind them. In short, it is a book about America, about fathers and sons, prejudice and courage, triumph and disaster, and told with warmth, humor, wit, candor, and love. (less)",sports
42,Sweet Home,3.98,Tillie Cole,"37,990","2,696","18,097 followers","At age twenty, Molly Shakespeare knows a lot.

She knows Descartes and Kant.

She knows academia and Oxford.

She knows that the people who love you leave you.

She knows how to be alone.

But when Molly leaves England's grey skies behind to start a new life at the University of Alabama, she finds that she has a lot to learn — she didn't know a summer could be so hot, she didn't know students could be so intimidating, and she certainly didn't know just how much the folks of Alabama love their football.

When a chance encounter with notorious star quarterback, Romeo Prince, leaves her unable to think of anything but his chocolate-brown eyes, dirty-blond hair and perfect physique, Molly soon realises that her quiet, solitary life is about to dramatically change forever...

Mature New Adult novel — contains adult content, highly sexual situations and mature topics. Suited for ages 18 and up* (less)",sports
